{
  "schema_version": 1,
  "registry_id": "investment_research_provider_activation_v1",
  "generated_at": "2026-08-26T08:00:00Z",
  "catalog_id": "investment_research_providers_v1",
  "connections": [
    {
      "provider_id": "akshare",
      "catalog_status": "adapter_required",
      "execution_policy": "probe_only",
      "data_plane_state": "adapter_contract_ready",
      "adapter": "provider_specific",
      "runtime": "github_actions",
      "transports": [
        "python_library"
      ],
      "required_configuration": [],
      "probe": {
        "method": "GET",
        "url": "https://akshare.akfamily.xyz/data/index.html",
        "scope": "control_plane",
        "expected_content": "any",
        "expected_statuses": [
          200,
          401,
          403
        ],
        "max_attempts": 3,
        "timeout_seconds": 15
      },
      "next_action": "Resolve one stable data endpoint, run a bounded payload probe, then implement its parser."
    },
    {
      "provider_id": "aletheia",
      "catalog_status": "adapter_required",
      "execution_policy": "probe_only",
      "data_plane_state": "adapter_contract_ready",
      "adapter": "provider_specific",
      "runtime": "cloudflare_worker",
      "transports": [
        "json_api"
      ],
      "required_configuration": [
        "ALETHEIA_AUTH_CONFIGURATION"
      ],
      "probe": {
        "method": "GET",
        "url": "https://aletheiaapi.com/docs/",
        "scope": "control_plane",
        "expected_content": "any",
        "expected_statuses": [
          200,
          401,
          403
        ],
        "max_attempts": 3,
        "timeout_seconds": 15
      },
      "next_action": "Resolve one stable data endpoint, run a bounded payload probe, then implement its parser."
    },
    {
      "provider_id": "alpaca",
      "catalog_status": "adapter_required",
      "execution_policy": "probe_only",
      "data_plane_state": "adapter_contract_ready",
      "adapter": "provider_specific",
      "runtime": "cloudflare_worker",
      "transports": [
        "json_api",
        "websocket"
      ],
      "required_configuration": [
        "ALPACA_AUTH_CONFIGURATION"
      ],
      "probe": {
        "method": "GET",
        "url": "https://docs.alpaca.markets/docs/market-data",
        "scope": "control_plane",
        "expected_content": "any",
        "expected_statuses": [
          200,
          401,
          403
        ],
        "max_attempts": 3,
        "timeout_seconds": 15
      },
      "next_action": "Resolve one stable data endpoint, run a bounded payload probe, then implement its parser."
    },
    {
      "provider_id": "associated_press",
      "catalog_status": "commercial_only",
      "execution_policy": "not_executable",
      "data_plane_state": "commercial_onboarding_required",
      "adapter": "generic_json",
      "runtime": "cloudflare_worker",
      "transports": [
        "json_api"
      ],
      "required_configuration": [
        "ASSOCIATED_PRESS_AUTH_CONFIGURATION"
      ],
      "probe": {
        "method": "GET",
        "url": "https://developer.ap.org/",
        "scope": "control_plane",
        "expected_content": "any",
        "expected_statuses": [
          200,
          401,
          403
        ],
        "max_attempts": 3,
        "timeout_seconds": 15
      },
      "next_action": "Obtain a commercial data contract and scoped credential before enabling any request."
    },
    {
      "provider_id": "benzinga",
      "catalog_status": "commercial_only",
      "execution_policy": "not_executable",
      "data_plane_state": "commercial_onboarding_required",
      "adapter": "generic_json",
      "runtime": "cloudflare_worker",
      "transports": [
        "json_api"
      ],
      "required_configuration": [
        "BENZINGA_AUTH_CONFIGURATION"
      ],
      "probe": {
        "method": "GET",
        "url": "https://docs.benzinga.com/",
        "scope": "control_plane",
        "expected_content": "any",
        "expected_statuses": [
          200,
          401,
          403
        ],
        "max_attempts": 3,
        "timeout_seconds": 15
      },
      "next_action": "Obtain a commercial data contract and scoped credential before enabling any request."
    },
    {
      "provider_id": "biztoc",
      "catalog_status": "catalogued_unverified",
      "execution_policy": "probe_only",
      "data_plane_state": "survival_probe_ready",
      "adapter": "generic_browser",
      "runtime": "github_actions",
      "transports": [
        "browser"
      ],
      "required_configuration": [],
      "probe": {
        "method": "GET",
        "url": "https://biztoc.com/",
        "scope": "control_plane",
        "expected_content": "any",
        "expected_statuses": [
          200,
          401,
          403
        ],
        "max_attempts": 3,
        "timeout_seconds": 15
      },
      "next_action": "Verify service survival and official documentation before defining a data endpoint."
    },
    {
      "provider_id": "brieftape",
      "catalog_status": "catalogued_unverified",
      "execution_policy": "probe_only",
      "data_plane_state": "survival_probe_ready",
      "adapter": "generic_json",
      "runtime": "cloudflare_worker",
      "transports": [
        "json_api"
      ],
      "required_configuration": [
        "BRIEFTAPE_AUTH_CONFIGURATION"
      ],
      "probe": {
        "method": "GET",
        "url": "https://brieftape.com/",
        "scope": "control_plane",
        "expected_content": "any",
        "expected_statuses": [
          200,
          401,
          403
        ],
        "max_attempts": 3,
        "timeout_seconds": 15
      },
      "next_action": "Verify service survival and official documentation before defining a data endpoint."
    },
    {
      "provider_id": "cboe",
      "catalog_status": "adapter_required",
      "execution_policy": "probe_only",
      "data_plane_state": "adapter_contract_ready",
      "adapter": "provider_specific",
      "runtime": "github_actions",
      "transports": [
        "file",
        "browser"
      ],
      "required_configuration": [],
      "probe": {
        "method": "GET",
        "url": "https://www.cboe.com/us/equities/market_statistics/",
        "scope": "control_plane",
        "expected_content": "any",
        "expected_statuses": [
          200,
          401,
          403
        ],
        "max_attempts": 3,
        "timeout_seconds": 15
      },
      "next_action": "Resolve one stable data endpoint, run a bounded payload probe, then implement its parser."
    },
    {
      "provider_id": "census",
      "catalog_status": "adapter_required",
      "execution_policy": "probe_only",
      "data_plane_state": "payload_probe_ready",
      "adapter": "provider_specific",
      "runtime": "cloudflare_worker",
      "transports": [
        "json_api"
      ],
      "required_configuration": [],
      "probe": {
        "method": "GET",
        "url": "https://api.census.gov/data/2023/cbp?get=NAME,EMP&for=us:*",
        "scope": "data_payload",
        "expected_content": "json",
        "survival_url": "https://www.census.gov/data/developers/guidance/api-user-guide.html",
        "expected_statuses": [
          200,
          401,
          403
        ],
        "max_attempts": 3,
        "timeout_seconds": 15
      },
      "next_action": "Run the bounded live payload probe, then add semantic parser and canonical-evidence tests."
    },
    {
      "provider_id": "congressinvests",
      "catalog_status": "catalogued_unverified",
      "execution_policy": "probe_only",
      "data_plane_state": "survival_probe_ready",
      "adapter": "generic_json",
      "runtime": "cloudflare_worker",
      "transports": [
        "json_api"
      ],
      "required_configuration": [
        "CONGRESSINVESTS_AUTH_CONFIGURATION"
      ],
      "probe": {
        "method": "GET",
        "url": "https://congressinvests.com/",
        "scope": "control_plane",
        "expected_content": "any",
        "expected_statuses": [
          200,
          401,
          403
        ],
        "max_attempts": 3,
        "timeout_seconds": 15
      },
      "next_action": "Verify service survival and official documentation before defining a data endpoint."
    },
    {
      "provider_id": "currents_api",
      "catalog_status": "catalogued_unverified",
      "execution_policy": "probe_only",
      "data_plane_state": "survival_probe_ready",
      "adapter": "generic_json",
      "runtime": "cloudflare_worker",
      "transports": [
        "json_api"
      ],
      "required_configuration": [
        "CURRENTS_API_AUTH_CONFIGURATION"
      ],
      "probe": {
        "method": "GET",
        "url": "https://currentsapi.services/en/docs/",
        "scope": "control_plane",
        "expected_content": "any",
        "expected_statuses": [
          200,
          401,
          403
        ],
        "max_attempts": 3,
        "timeout_seconds": 15
      },
      "next_action": "Verify service survival and official documentation before defining a data endpoint."
    },
    {
      "provider_id": "data_gov_tw",
      "catalog_status": "adapter_required",
      "execution_policy": "probe_only",
      "data_plane_state": "adapter_contract_ready",
      "adapter": "provider_specific",
      "runtime": "hybrid",
      "transports": [
        "json_api",
        "file"
      ],
      "required_configuration": [],
      "probe": {
        "method": "GET",
        "url": "https://data.gov.tw/",
        "scope": "control_plane",
        "expected_content": "any",
        "expected_statuses": [
          200,
          401,
          403
        ],
        "max_attempts": 3,
        "timeout_seconds": 15
      },
      "next_action": "Resolve one stable data endpoint, run a bounded payload probe, then implement its parser."
    },
    {
      "provider_id": "dino_markets",